User,Text
PSelemadeg,ayo hadiri gerai vaksin tni polri yang akan dilaksanakan pada hari jumat tanggal oktober jam
deblacklisto,aku yang sedih sinovac ga diterima di uk tapi ga punya duit buat ke uk juga
9701KJUNE,gak becanda sinovac dong
inginkansurga,selamat siang dok mau tanya dok beda vaksin sinovac sama moderna apa ya dok katanya bagusan moderna ya dok
JaeKyeom1826,gpp aku aja1 amp 2 sinovacvaksin modernagpp kok
infomalang,cek di faskes pertama yakarena moderna belum ada bukaan umum untuk dari faskes lain di malangsinovac ada di polkesma
kupastuntasnew,badan intelejen negara bin daerah lampung telah menyuntikan ribu dosis vaksin sinovac ke pelaja
candieshoon,eh vaksin kedua tuh sinovac yh
yusnitarh28,ayeee ayeee kelar vaksin juga baru ngeh vaksin coronavac vaksin sinovac boleh beda gitu kah
emsytk,tiada cuma anu pandai berlawan aku pfizer aku sinovac dorang bilang
navxlty,iyaa benerr aku juga sinovac jadi cepet ngantuk