User,Text
safrudi53158735,sekarang dah ditambah utk umroh dan haji buka
aureaarayaa,sinovac bnrn gabisa buat ke luar negeri kah
IbrahimAyob0805,alhamdulilah terima kasih yb memberi perhatian kpd jemaah umrah sinovac yg perlu b
JRKAceh,sabtu minggu puskesmas dan pustu di aceh utara tetap layani vaksinasi bisa pilih sinovac moderna
eclipstar_,baru aja selesai vaksin pake sinovac gabisa ke luar negeri dong tapi emang gaada duit juga sih
jemcotton_,ehh samaaa kita sinovac kita boleh pergi umrah cumanya kena amik rd dose as booster tuuu
nalendraprdm,lagian gue anak rumahan ga mungkin keluar negara sinovac cukup
Adrianxxzyh,di ceramahin bunda gara gara vaksin sinovac wkwkwk
mbarep_panji,wehh yg vaksin sinovac ga boleh keluar negri waduh ibu gua dulu batu bgt gua bilang vaksinnya nanti aja pas dulu s
iktibarikhlas,call china depa tak terima selain sinovac
WindaAp57133888,intinya mau vaksin modern atau pfizer tetap harus di booster bukan cuma sinovac aja
sekilasaceh,sabtu minggu puskesmas dan pustu di aceh utara tetap layani vaksinasi bisa pilih sinovac moderna
dandellilacs,iyaaa nerima kalo sinovac ada beberapa negara yang gak mengakui termasuk thailand makanya yang divaks
mahataee,puskesmas daerah ku rata2 sinovac kak bukan pfizer
saifulnang,yb kami mohon dipercepat booster shot pfizer bila pm umum boleh keluar negara kami yang dah hampir ta
kikincia,sinovac az apa pfizer aku lg otw dosis kedua wkwkwk hayaakuuuuneee dolan dolaaannn
SeputarPonorogo,link pendaftaran vaksin gratis di ponorogo tersedia kuota sinovac dosis segera hubungi kontak ini berit
Micasaeu,ya allah gue sinovac kmrn plis gue ada rncana mau keluar padahal tch mendokse
ariandhka,yang vaksin sinovac emang nggak boleh keluar negeri ya
dandellilacs,bener mana bekas disuntiknya sakit banget anjir tapi gpp bersakit sakit dahulu berenang renang kemudian
namkooksha,bisaaa tp booster ny ga sinovac
jikookpcaran,agak nyesel kenapa kemaren vaksin ga ikut yg disekolah malah ikut yang di luar kalo disekolah harusnya dpt yg pf
namulysian,gangerti sih tp ada yg bilang sinovac ga diterima di luar
serambinews,titik dimaksud di puskesmas dan puskesmas pembantu pustu dalam kecamatan di aceh
sequoiaderie,yaampun serius aku tim basic aka sinovac bisa apahhh
kthxkyn,sinovac susah d terima d luar negeri
Lantari7,komando distrik militer sleman bekerjasama dengan aparat terkait dan stakeholder kembali melaksanakan serbuan
reberrlatte,eh mau nanya dong kalo kita udah vaksin dua kali tapi yg sinovac nah bisa gak kalo vaksin lagi yg pfizer
grassontop,kalo dijerman vaksin sinovac gak diakuin sama negara yg diakuin ya moderna astra dan vaksin2 lokal sana
Junaidy_Hanafi,arab saudi pun sama melampau betul nak pergi mekkah orang yg ambil vaksin sinov
mieghaaaaa,ya allah sama semua pfizer weh i sorang je sinovac dah lah planning nak pergi umrah jugak insyaallah
jemcotton_,i dapat sinovac sebab tu gelabah teruk ni family member yg lain semua dalam comfort zone sbb dorang
maybecanbeyours,tambahan ya tergantung sama kebijakan negara juga di selain jepang juga ada yg accept pake sinovac
maybecanbeyours,ah intinya dia jadi kali gitu vaksinnya kalo buat ke jepang kalo ud
qomiyaoff,soalnya kalo sinovac ataupun vaksin indo tuh diluar negeri ga keitung jadi harus vaksin yg beredar di n
soulxmateu,beberapa negara ga terima vaksin sinovac saran gue lu tanya dulu udah coba hubungin kedutaan nya gak
bluebluethings,iyaaa bener kynya soalnya umroh jg gtutp nanti dikaish booster vaksin sesuai yg diterima dinegara di
vindhietama,gw sinovac yg pfizer adek gw efeknya demam juga sama pegel harian tangan
nand0___,iya beneran bbrp negara ada yg gk nerima sinovac soalnya made in china
axamexo,terus kalo misalkan mau ke luar negeri tapi udah di vaksin sinovac berarti vaksin lagi dong yang varian lain
convomf,emg kalo yg kemaren vaksin sinovac nanti bakal ada suntik booster moderna ya
5hortc4ke,emg ada beberapa negara yg ga ngizinin sinovac
mangomatch,gue mau sinovac atau astra pun juga gak keluar negeri sih yang penting udah vaksin alhamdulillah aja
dyah_sulistya,saya teh fid telat bulan habis vaksin sinovac waktu vaksin gak telat
bon_2x1,kalo jepang iya harus astra ama apa gitusinovac ga dibolehinkalo selain jepang aku g tau
hawaiisunkissed,setahuku memang dibeberapa negara luar ngga pakai vaksin sinovac cuman beda dilama karantina aja misa
mas_an2,wes ra sah kakean cangkem aku kiasline ultramen tapi bar vaksin sinovackekuatanku dadi ilang
bblueberriy,eh ini seriusan syukurlah mama dah pasrah gagal umroh karna dah terlanjur sinovac
thisisillegurl,w yang nya sinovac hanya bs tersenyum
avoocadtoast,mau ngurus kewarganegaraan tapi vaksin gue sinovac terhalang kasta vaksin
haniiyya,mungkin yg dapet sinovac pas awal awal vaksin jd belum bisa milih klo saat ini udh bnyak macamnya
yimaaaaaaa,sinovac boleh asal pake booster ya ga si soalnya kakak aku sinovac terus mau nganter rombongan umroh harus divaksin booster
jjkslof,klo mau umroh haji setauku klo sinovac harus dosis cmiiw
Chika0699,efek sinovac bikin laper
faircyj,ya karena sinovac dah ga digunain lagi di beberapa negara akibatnya ditolak gt ntar
faridzdzdz,kalo ke amerika gabisa pake vaksin sinovac ya
jemcotton_,okay serious question i saw that kalau nak pergi umrah either ppl injected with pfizer and az je yang lepas kalau
yusuprhmn,tadi tuh suntikan diisi sinovac atau diisi scott emulsion ya kok malah lapar mulu
guntxrmdp,australia ngga nerima sinovac kayaknya
clalareine,yang penting pak jokowi juga sinovac
doinyacrush,emang knpa kok sinovac gabisa ke luar negeri
dthido26,boleh ga nih gw udh vaksin sinovac tapi vaksin lagi buat yang varian lain like moderna pfizer dkk
vindhietama,gw cukup sinovac ajasoalnya manut daerah jogja banyaknya apa aja
almauliay,tetanggaku bisa loh ke amrik dia sinovac tp dia emg pertukaran pelajar sih mungkin ada pengecualian
vindhietama,efeknya keras pfizer sama moderna nah kalau yg sinovac mau ke keluar negeri gimana ya booster tambaha
WindaAp57133888,sebagian negara gk mau terima kalo vaksin nya sinovac kalo mau pergi haji umrah juga gk bisa kalo vaksin nya sinovac
kanalauv,kalo kata pak hafan mah tadi bukan masalah mana yg lebih baik cuma emang komponen vaksinnya aja yg beda kalo sino
lalavivienrose,ini gak sepenuhnya bener ya beritanya gak semua negara mewajibkan orang buat vaksin dulu orang indo b
notelrisa,ada beberapa yg ga nerima sinovac nder
SahitaFathur,sinovac yang murahan nder astra itu efektivitas vaksinnya lebih tinggi
selalujae,iya sinovac itu ngak di terima di luar soalnya dulu tuh ada yg sinovac gadungan tapi beberapa negara ada yg bolehin kok
bngmstkw,nah itu ngeliat katanya jepang ga ada sinovac jadi kek terus ni vaksin gimana
tybelleame,bisa sinovac buat abroad tp harus kali cmiiw
_stfdhl,katanya gitu nder klo selain sinovac boleh katanya tp tiap negara punya aturan masing2
xniaaw,beberapa negara ngebolehin kok kalo negara yg dituju ngga boleh sinovac biasanya dibooster lagi pake astra pfizer moderna
Askrlfess,askrl ke korea sama jepang udah boleh pake v ksin sinovac blm ya menurut kalian kebijakan merema bakal berubah ga
SyahrulAM13,iya katanya mah gakepake sinovac kalo diluar negri kalo mau keluar negri paling vaksinnya astra
peachyEaj,iyaaa setau ku sinovac tidak di akui di luar negri wkkwwkwk jdi hrus booster lgi
haze_rays,kalau mau keluar negeri emang gak cukup klo sinovac doang vyr pake booster moderna atau yg lain aja
thissjunky,coronavac itu nama riset nya kl sinovac itu produsen pengembangan nya gitu cmiiw
tr0uavaille,lah emang kalo vaksinnya jenis sinovac ngga bisa ke luar negeri
halosungjin,ga semua negara tapi kebanyakan ga nerima sinovac
aneupyo,beberapa negara ga mengakui sinovac jd kalo mau ke ln besok vaksin ke3 booster moderna
KancilPutih11,kesian sinovac
TehManisPanas4,tahun lalu mereka nyinyir mengenai kehalalan vaksin sinovac sehingga mereka menolak divaksin tetapi tahun ini mere
HumasPolsekKed4,polsek kedungwaringin dan pkm kedungwaringin berikan layanan vaksinasi dosis dan vaksin jenis sinovac di aula d
FMasriati,mau moderna mau pfizer mau sinovac yg terbaik adalah vaksin yg tersedia dan yg tercepat diakses
polresdemk,ayo ikut vaksin merdeka candi polres demak vaksin dosis amp 2 sinovac setiap malam minggu mulai pukul
kel_pejuang,halo warga kelurahan pejuang hari ini kembali diselenggarakan gebyar vaksin massal sinovac astrazeneca amp pfizer
aurum3as,iya astra sama moderna yg agak keras klo temenku yg dpt sinovac sinopharm yg kerasa paling ngantuk laper capek
UMonline,tambah khairy banyak negara islam menggunakan sinovac seperti indonesia pakistan dan turki dan oleh itu penting
NunutUswatun,alhamdulillaah gadisku karena mo terbang divaksin sinovac msh dpt haid
HBaturiti,ayo hadiri gerai vaksin tni polri yang akan dilaksanakan pada hari senin tanggal oktober jam
BorneoSMR,ayo vaksin kelompok suporter republic orange pusamania mengelar vaksinasi massal di areal parkir stadion segiri
karimatafm1033,vaksinasi covid 19 makin digenjot stok sinovac di sumenep menipis fit
PSelemadeg,ayo hadiri gerai vaksin tni polri yang akan dilaksanakan pada hari senin tanggal oktober jam
PolsekPupuan,ayo hadiri gerai vaksin tni polri yang akan dilaksanakan pada hari senin tanggal oktober jam
Kotabekasinews,kata siapa vaksin covid belum diuji
CNNIndonesia,pemerintah arab saudi mewajibkan jamaah umrah asal ri yang divaksin menggunakan sinovac untuk vaksinasi booster ap
HamzahF26388518,salam bertanya yb mohon penjelasan arab saudi tak terima vaksin sinovac utk umrah bila bol
Sundafess_,punten mau nanya hari ini atau besok ada yang di daerahnya ngadain vaksin sinovac ga mau vaksin kedua mumpung libur
Polsekwangon21,monitoring pelaksanaan vaksinasi astrazaneca dan sinovac di pkm wangon
bekokjin,sinovac vaksin ke dua ready kak
niksunpcrn,tetep harus sinovac nder bilang ke petugasnya
bubblyna_,aku sinovac tp udah mens sih kmrn abis vaksin mungkin agak telatan dikit gitu
nisakdisini,di aku sinovac amp 2 ga berasa samsek
felixfairydust,mjb heheh tapi aku vaksin pertama pake astrazeneca langsung demam seharian katanya tergolong kuat
ftdxxn,emng nya knp kalo vaksin nya sinovac
hyuckcarirejeki,selamat pagi pak bu izin bertanya apakah ada jadwal vaksin dosis sinovac pak bu dan kalau say
DesaTulusbesar,info vaksin dibuka pendaftaran ulang vaksin dosis sinovac dengan kuota orang khusus warga yang vaksin di
yourjoxxy,aku pake sinovac krn baru sku vaksin di sekolah dan yg pake astrazeneca cuma yg udh tahun doang
exeuthanasia,di aku ga ada efeknya sih kalo sinovac cuma emg agak pegel aja pas besoknya xixi
RidhaRf,vaksin prtama cepet petugasnya bnyak giliran vksin kedua yaallah antrian sinovac pfizer sm moderna digabung
anmbrh2,aku dosis sinovac kok ga kerasa ya hehe
vinxki,saya sudah divaksin astrazaneca tadi pagi mulai sekarang saya tida mau main sama yang belum vaksin tapi kalo sudah
UINSK,info vaksinasi dosis sinovac kolaborasi polri dengan satgas covid 19 uin sunan kalijaga selengkapnya di
Humaspolrespas1,giat vaksinasi yang dilaksanakan oleh tim gerai vaksin presisi polres pasangkayu pada hari sabtu tanggal oktober
polsekkdrkota2,bktm setonopande aiptu syaifudin yuri di kantor cabang pegadaian jl patimura no 144 kelurahan setonopande kota k
PKCTamansari,vaksin malamjl krajinan raya samping mushola peninggalan abad al mahbup kel keagungansinovac dosis amp 219 00 s
PKCTamansari,sinovac dosis dan kantor rw maphar masyarakat umum gt 12 th 200 orang 2 kantor rw tamansari masyara
ThisHerlambang,min hari ini ada jadwal vaksin sinovac dimana ya buat kecamatan bogor selatan
eogiocha,aku vaksin sinovac akhir juni lalu sempat positif dg gejala ringan dinyatakan sembuh juli vaksin
nayyoraa,sinovac klo bekas suntik sama tangan sama sekali gak ada efek
ddiwaiyaa	ak kemaren sinovac jdnya ngga knp2 siii kakk		,
karinajakpus,dapetnya sinovac
Sinovac_pick,semoga slamat smpe tjuan wak
Sinovac_pick,semoga da rezeki
beutydion,nya gue sinovac
Cerita_Parapuan,jadwal vaksinasi sinovac dan astrazeneca di jakarta sabtu oktober
zackyrvai,hai temen2 terimakasih respon pengalaman vaksinnya untuk tweetku sebelumnya btw udah jam dr aku vaksin dgn kond
erinfd,aku juga gtu habis vaksin sinovac dah bulan ga mens
DonAdam68,catet auditorium academic amp researchuin raden intan lampungvaksin astrazenecausia thn ke atasconvention h
waterbbeom,enggak teh aku x vaksin sinovac mensnya lancar seperti biasa gak telat sama sekali coba teh tanyak
sukamainkehutan,aku vaksin sinovac dosis ke ditanggal agust malah mens dri tanggal agust sampai sept
vrelvv,kenapa baru ada vaksin astra sekarang gue udah vaksin sinovac seminggu yang lalu
gampangmigrain,dia ga pernah kena covid dia udh vaksin sinovac
ujuyuju_,sinovac anj bgt dah masa iya w kena koronce kali setelah vaksin kek paan njir padahal w dirumah aja demiallah
polsekkuta,gerai vaksin polri ayoo sobat polri yang belum vaksin atau yang vaksin ke silahkan hadir di gedung rs murn
eventsurabaya,halo gais yukkk dengan mendukung program pemerintah pkb mengadakan vaksinasi sinovac dosis dan dengan kuota
penkopassus,grup kopassus terus gelar serbuan vaksinasi kepada masyarakat umum dosis 2 sinovac di sendangsari bantul jumat
wilofyou	dikira vaksin pertama dapetnya astra setelah bulan lebih minggu mau vaksin kedua ternyata vaksin pertama sinova		,
zazillahf,katanya sinovac cek sertifikat kok ternyata pfizer
maudinadah,waduh kenapa ga mau pake sinovac aja yg gaada efek samping nya dampingin jangan sendiri kalo bisa ber
SafiraPuspaning,blman nih kayanya ntar nyari sinovac aja deh soalnya gue udh ada antibodi alami juga dr virus corona
nsdifa_,alhamdulillah haid ku masih lancar teh kmrn habis vaksin sinovac cuma demam aja teh
rifka_seftiani,kalau pfizer dan moderna zat aktifnya ya mrna kalau sinovac zat aktifnya yah in activated virus covid kalau astra
KardusIndomie8,aku tidur jam bangun jam buat vaksin sinovac masih okelah dibadan tapi aku saranin mending tidur dulu jangan begadang
tinkywinkies_,aku vaksin sinovac dosis kedua pas disuntik kerasa lebih nyeri dari dosis pertama sih nder terus lebih gampang ngantuk
0902Trd,kodim berau melalui koramil 05 sambaliung lakukan vaksinasi dosis dua vaksin sinovac
sherere_sw,mana ada sinovac juga keluar kota mah masi bisaa
shaewonu,gak sakit klau sinovac tapi kamu harus makan minum c1000 dan gak bergadang
EnyLove_1,yaa kan modernaaku juga klo selain sinovac ga perlu di booster
baramafa,ni kira kira by the end of october ada stok az gak ya di puskesmas kek yang di highlight kalo gak sinovac sama pfi
eventsurabaya,halo gais yukkk dengan mendukung program pemerintah pkb mengadakan vaksinasi sinovac dosis dan dengan kuota
namjohnnyy,aku udh kali vaksin pake sinovac alhamdulillah gaada efek apa teh apalagi telat mens mungkin tiap org beda beda kali ya
hadifianwidjaja,saya dari awal pilih sinovac tentunyahhhh karena saya lebih yakin dengan metode in activated whole virus
EnyLove_1,info dong bagaimana cara nya dapat vaksin booster selain sinovac aq bukan nakes syarat masuk ke negara sa
PakdeSodik,ude paksin komplit sinovac astra ffizer moderna sinopharm teman dari malaysia datang bole kumpul
bdngfess,euy info vaksin sinovac dund
txtadit,belum dosis kedua nih kalo pake az lumayan jangkanya tp kalo sinovac ayah saya biasa aja cm lebih sedikit
Lantari7,komando distrik militer sleman bekerjasama dengan aparat terkait dan stakeholder kembali melaksanakan serbuan
sherlynzlee,kayaknya tergantung merk vksinnyakalau moderna sama az mah siap siap paracetamol sama obat anti muntah pfizer
tempodotco	rshs bandung riset internal proteksi antibodi dari vaksin sinovac hasilnya		,
sambatankukabeh,boleh kok sinovac
laabilla_,agak nyesel kenapa waktu vaksin pertama kali malah milih sinovac
bayiicumi,bolehh kata dr anastesiku kalo udh sinovac x yang ke harus pfizer moderna
prettysashimi,jadii kalo aku sinovac pertama keduanya boleh gitu moderna misalkan
sapsuper,besok polsek kediri kota vaksin amp jenis sinovac lak mau vaksin vaksin hrs sinovac
badutmekdonald,ada ga yg vaksin langsung moderna ga sinovac dulu
ShilaNatasha22,baru plan nk travel jauh sikit next year tp lupa team sinovac hahaha takpelaa kita pusing2 dekat2 jelah
onenonly57,tapi mr saya penerima sinovac yang tak dianggap vaccinated oleh uk
tanciukian,biasakan membaca keterangan di foto info vaksin sabtu oktober jam 00 s d 00 wibsilakan datang ke
saoriisaostiram,aku udh vaksin x sinovac alhamdulillah lancar2 aja mens
minbisadong,aku sinovac juga nder udh kelar dosis tp gada kek gitu coba periksa dehhh takut ada apaapabtw kalo
rinsxl,aku kemaren vaksin kedua sinovac hari kamis terus besoknya jumat sore mens
bewara_jabar,cianjur pemerintah sudah menginformasikan terkait vaksin sinovac yang di datangkan langs
dinkespati,hingga rabu oktober capaian vaksinasi di pati mencapai sementara untuk bisa mencapai ppkm level dip
nihayarina,info jadwal dan lokasi terbaru vaksin jember madiun malang tuban oktober sinovac dan astrazeneca
kalibawangkp_,kalurahan wani vaksin dosis akan hadir kembali di kapanewon kalibawang bagi yang sebelumnya menerima vaksin sino
galiharlanosa,tolong info vaksin sinovac dosis kedua untuk besok dong
capcaey,aku baru kmrn banget divaksin sinovac dan aku lupa kapan terkahir mens 8
PiaPinah_MH,antara sinovac dan pfizer sya rasa vaksin pfizer lagi kuat berbanding sinovac pfizer
Sek_Cly,untuk pendaftaran vaksin sinovac hari sabtu oktober di klinik polresta bandung jl bhayangkara soreang s
PiaPinah_MH,bagi mereka yg ada allergy teruk masa amik vaksin dos pertama kes akan di siasat jik
pngfess,lur info vaksin dosis ke2 sinovac hari selasa oktober
DMunjungan,antusiasme warga masyarakat sangat tinggi hal tersebut dibuktikan dosis vaksin sinovac habis bahkan mendapatk
dinharris,nasib baik ambik sinovac
jembermfs,jbrfess info lokasi vaksin dosis sinovac area sumbersari dong terimakasih
RainaVerina,sama sinovac jugaa kok jd aku belum vaksin juga ampe sekarang heuu
DMunjungan,dalam rangka mensukseskan program vaksin yang dicanangkan oleh pemerintah pusat dengan ini dpd nasdem trenggalek me
kissfmjember,penerima vaksin sinovac dan sinopharm bisa berangkat umrah dengan syarat
PolresTasikKota,gerai vaksin presisipolres tasikmalaya kotadilaksanakan pada hari tanggal sabtu oktober pukul
anissriww,min mau nanya apakah bisa vaksin dosis sinovac di stasiun
darkmode94,aku sinovac keamren nafsu makan jadi nambah drastis
gyulinggyull,aku jga teh walaupun engga sinovac mens lgi gak lancar
Purpleecityxx,aku sinovac teh dan mens pun lancar gk telat gk maju tanggalnya
andresippp,ak kmrn sinovac sen malemny si badan agak anget sma ngk nyenyak tidurnya malah nga ngerasain pegel d bagian suntikny
ANSI_421,untuk jangka waktu antara vaksin dosis ke dosis harus dipatuhi dan lama jangka waktunya tergan
kungkongg,sorry jbjb memang ada bbrapa negara yg ngga nerima sinovac ka tapi ada juga yg nrima trgantung negara m
yeyoosh,tergantung jenis vaksin kalo sinovac kebanyakan gak ada efek paling pegel bentar dilengan yg disuntik
bukhoriam,moderna memang mantap ya kipi nya dulu sinovac kali sama sekali tidak terasa apa apa setelah vaksin
_robbyruben,sinovac besok ada mulai jam biasanya jam sudah habis
junkyuubom_,baru sadar aku juga abis vaksin sinovac tgl september sampe skrg blm mens
juliantojulis,gk blh hrs sinovac jg
mrswoobling,sedih amat yg vaksin sinovac masih ngga bisa masuk eu gimana dooonggg
anirun_,sinovac jugaa kemarin telat hari aja gatau nih bulan depan gimana hahaha
Jhnyuchn,min infoo vaksij sinovac daerah bekasii dongg
R_Perkasa,yang mau vaksin pertama pfizer dan vaksin kedua sinovac besok di phinisi point bisa klik link di bawah ini
feelsoweird,aku baru sekitar minggu lalu vaksin dosis sinovac ini telat mens hari
watcudoinghuh,maaf teh di aku malah lancar awalnya telat mulu tanggalnya semenjak abis vaksin sinovac juga kebe
alfyrhaa,ya efektivitas nya ktnya emg lebi rendah tp kan maksudnya itu ud approved by who ya knp sinovac banyak ga diakuin si
penasedu,coba ke dinkes nder kemaren stock sinovac lumayan banyak disana
Kodim0815Mjk,danramil 10 bangsal diwakili bati tuud pelda siswanto mendampingi bupati mojokerto dr hj ikhfina fahmawati
blackforestkeik,bentar ini maksudnya gimana ya ko aku kurang mudeng nakesnya salah apanya but yg terpenting selagi j
strwxbrri,emang sepertinya sama kemarin habis nganter nenek juga buat vaksin dosis padahal hari itu jadwalnya
sukaseokjin,ahhhh sekarang udh jarang ya yg sinovac
jinourmoon_7,nyari vaksin dosis sinovac dmn yaa
JK_noona,entah efeknya apa bukan tapi bulan lalu aku juga telat mens semingguan habis vaksin padahal bulan bulan sebelumnya
sakuraaaberyy,gak dong sinovac doang aahh insyaallah kecil
zetzetzetoy,aku sinovac bulan mei akhir teh baru mens bulan juli awal
rllynotm3,kalo aku sinovac tapi ga sampe ga mens cuma telat banget trus darah haidnya cuma bercak bercak gitu
ajengay7,alhamdulillah haid ku masih lancar teh kmrn habis vaksin sinovac cuma demam aja teh
inoselling,aku baru aja kmrn tgl vaksin kedua sinovac harusnya awal bulan ini udh mens sih cuma ampe sekarang belum t
dyahtantri,aku vaksin sinovac dan telat bgt mensnya
GoNewsdotco,sinovac tak diakui para wni ke luar negeri untuk vaksin lagi
dearcyeonjun,aku dpr sinovac kmrnn
ahanuuum,aku abis vaksin sinovac malah mens nya kali dlm bulan nderrrr
auliaahsan_,aku vaksin sinovac terakhir juni dan sampe skrg ga mens
HumasPasirjambu,untuk pendaftaran vaksin sinovac hari sabtu oktober di klinik polresta bandung jl bhayangkara soreang s
mdoktav,minn infoo vaksin sinovac dosis pertama adaa ndak nggih
wartakotalive,jadwal vaksinasi covid tangerang sabtu oktober di kecamatan pakai sinovac dan pfizer
wilanpangestu,aku juga ga mens habis vaksin sinovac
arisromanisti1,sama dong udah x vaksin sinovac gak mens sampai krg
MariaSimorang15,min kalo ada info vaksin sinovac terbaru boleh dong min dishare
plumyavocatto,aku vaksin sinovac juga pas dosis kedua pulang lgsg mens mana lumayan deres
GoNewsdotco,sinovac tak diakui para wni ke luar negeri untuk vaksin lagi
hadifianwidjaja,kalau pfizer dan moderna zat aktifnya ya mrna kalau sinovac zat aktifnya yah in a
cullezra,iyaa soalnya aku vaksinnya lumayan awal jd masih sinovac pakenya
SektorPlayen2,jum at 15 10 pelaksanaan vaksinasi dosis i dan ii oleh urkes polres gunungkidul di balai kalurahan banaran kapane
ttyongiiboo,aku udah kali vaksin sinovac pas lagi mens sih teh
NATSSJN,ak cuma pegel doang btw ak sinovac
RJinoona,iya emg multiple dose single dose waktu itu cuma sinovac pas awal2 aja skrg ada yg ada yg udah ga single lg
ingeesoesanto,aku bkn vaksin sinovac sih aku vaksin az yg kedua terus telat haid sebulan stgh amp ternyata di sekit
YooRi_L,aku kira cuma aku yg jadwal mensnya telat banget setelah vaksin sinovac ternyata di reply teh fidy
AlyaKartini,aku jg sama blm dpt lg dr setelah vaksin sinovac yg dosis udh jalan hampir bulanan ini benera
ppiwpew,mjb sinovac ga sakit kok waktu dosis itu cuma pegel aja lengannya waktu dosis aku ga ada efek ka
afiikoo,ihhhh yaallah sama banget teh aku jugaaaa abis vaksin sinovac ga mens
yourhoobae__,ini iya juga yaa aku juga dah bulan lebih antara abis vaksin sinovac jatohnya bulan lebih atau abis kena co
puduuhyuck,gue udah vaksin sinovac engga sakit samsek beneran
infomalang,kalo sinovac dan astra zeneca bisa tapiiiisuliiiit dapetnyaadanya cuma di polkesma atau rs umm kal
bilaes0k,lah sama gua juga dr vaksin sinovac pertama ga mens2
peach2620,aku sebulan gak haid habis vaksin sinovac
tiwayrx,aku vaksin kolaborasi astra sinovac mens kok coba periksa ajaa ke dokter teh
tiwaytrackyoo,akuu aku abis vaksin sinovac dosis bukan ga mens tapi telat mens lumayan lama
mwv_mystic,aku gitu mba abis divaksin sinovac ga mens
xrdfagh,seminggu lalu abis vaksin sinovac kmren mens kok teh
redkiwiy,sinovac soalnya angkatan juli agustuskalo angkatan sekarang banyak yg dapet pfizer moderna
grumpimpim,aku vaksin ke 2 sinovac atau agustus kemaren terus biasanya mens sebelum tanggal 3 tuh jadi
bunnyxnyn,aku rencana katanya vaksin dua vaksin sinovac
ANKKOSANNNNN,aku vaksin sinovac gada efek apa apa teh kyak hari hari biasa nya aja gtu
Defodioo,aku abis vaksin sinovac gaada masalah apapun terkait mens teh tapi temenku ada dia jadi telat mens gitu
ptriavia,aaku teh abis vaksin sinovac telat kurleb harian
AurelNovelia,bahan baku atau bold yang berasal dari produsen yaitu sinovac biofarma sinovam astrazeneca moderna pzier dan
moeslim_choice,masyarakat tidak perlu pilih pilih merek vaksin covid 19selengkapnya di
zzzjjul,eh iya teh bulan kemarin abis vaksin sinovac tahap terus sampe sekarang belum mens udah telat m
ppyoontj,aku dari sebelum mens emg ngga teratur sih teh jadi ga berani menyimpulkan krn sinovac juga
_jun_hoe,loh iya gw blm mesn udh mau bulan kemaren pake vaksin sinovac
jsuhmanis,aku habis vaksin kedua sinovac tgl september kemaren sampai sekarang belom mens juga
baby__loey,aku sinovac dan tetep lancar teh haidnya tapi waktu itu pernah ditanyain pas mau vaksin ke haid l
real______nn,aku dulu abis vaksin kedua sinovac langsung mens sih masih lancar sampai skrg
live_anymore,kemarin itu aku telat sampe harian hbs vaksin sinovac eh besoknya lsg mens wkwkwk
sagibitchs,kalo terpaut jauh waktu antar dua vaksinasi bisa diitung vaksin ulangan jd nanti yg dianggap vaksin
jiisygkoo,aku kemaren abis vaksin sinovac absen mens sebulan kak
hmadaarthur,aku sinovac aman cuma waktu itu untuk pertama kalinya lagi setelah sekian lama pas mens tumben ga d
93kagemusha,akuu malah mens kali dalam sebulan teh abis vaksin sinovac baik dosis pertama dan kedua jd aku
echanmwin,aku baru semingguan yang lalu vaksin sinovac teh gatau juga belum masuk tanggal haid jadi gatau nta
shyyytan,aku sinovac dan dapet terus kok tp telat gitu beberapa hari
imyoursje,aku vaksin sinovac tp mens nya normal normal aja teh
karantinajambi,kami bekerjasama dengan karantina kesehatan pelabuhan kkp dalam program pemberian vaksin ini jenis vaksin yang
Amaateeraasuu_,setelah dipikir pikir habis vaksin sinovac siklusku jadi siklus panjang teh tapi beberapa bulan ke
ilobematchaa,aku abis vaksin sebulan ga halangan sih teh dan pake sinovac pas itu juga dosis
renysekuntari,jadwal vaksin kota bogor oktober di mall btm bogor jenis sinovac dosis
