User,Text
Lantari7,komando distrik militer sleman bekerjasama dengan dinkes ka sleman uty aparat terkait kembali melaksanakan se
idtodayco,sinovac tak diakui para wni ke luar negeri untuk vaksin lagi
OctopussyMiss,yang ini ketinggalan dok biar jelas kalo datanya cuma dari vaksin aja tanpa az apalag
BetaEpsilonPhi,karena1 mayoritas divaksin sinovac pns yang lansia gt 60 tahun adalah peneliti jabfung utama
IBGXXDRGN,sehaaat kalau gw masih bisa on berarti masiu sehat wkwk kalau sinovac masih riangat efeknya kecuali kaya
NagregPolsek,untuk pendaftaran vaksin sinovac hari sabtu oktober di klinik polresta bandung jl bhayangkara soreang si
Vermoutthhtt,aku udah vaksin x pakai sinovac gak pakai rekomendasi dokter aman aman aja
beritaKBR,arab saudi belum mengizinkan calon jemaah yang menerima vaksin sinovac dan sinopharm kecuali sudah disuntik vaksin
PolsekCangkuang,untuk pendaftaran vaksin sinovac hari sabtu oktober di klinik polresta bandung jl bhayangkara soreang s
ubsi_cs03,jenis vaksin sinovac vaksin ke 1 dan vaksin ke 2 persyaratan dibuka untuk masyarakat umum fotocopy ktp u
PolsekBanjaran,untuk pendaftaran vaksin sinovac hari sabtu oktober diklinik polresta silahkan chat no wa
arfiani1810,nganter bocah vaksin dosis ke2 sinovac daftar pake aplikasi jaki kuota tersedia di plaza semanggi jam 13 30 antr
Vvanyol,alhamdulillah tk sia sia perjuangan aku call sna call sini bising2 finally dpt sec dose vaksin padahal sinovac
Kemenkumham_SUM,kemenkumham sumut bersinergi dgn alumni usu gelar vaksinasi massal di labuhan batu
Cupuwatu2ID,bagi masyarakat penerima vaksin sinovac dosis di luar balai dusun cupuwatu ii dan sudah memenuhi jadwal waktu unt
kuaciiiiii,nasib baik saya dapat sinovac
KAI121,tersedia vaksin jenis sinovac untuk di stasiun surabaya gubeng ya terima kasih
Cupuwatu2ID,diberitahukan kepada masyarakat yang telah menerima vaksin sinovac dosis pada tanggal september di balai
ChamzahMuhammad,udah kelar alhamdulillah vaksin sinovac
kontenislam_com,sinovac tak diakui para wni ke luar negeri untuk vaksin lagi
OposisiCerdas,sinovac tak diakui para wni ke luar negeri untuk vaksin lagi
RepelitaO,sinovac tak diakui para wni ke luar negeri untuk vaksin lagi lewat online
geloraco,sinovac tak diakui para wni ke luar negeri untuk vaksin lagi
Official_UNESA,lagi sttal gelar serbuan vaksin covid 19 dosis dua jenis sinovac di
Kel__Jatiasih,giat vaksin sinovac amp pfizer koramil rw dan penempelan stiker vaksin 13 10 2021
PemkotBPN,panggilan vaksinasi covid 19 masyarakat umum kota balikpapankhusus antrean 24 500 yang telah mendaftar m
VIVAcoid,sinovac tak diakui para wni ke luar negeri untuk vaksin lagi
Gigihimanadi,kemarin siang saya vaksin sinovac dosis di rs sardjito jogja tentu saja saya melihat bejibun manusia yang butuh
indahsiha,pak tolong stok vaksin sinovac di banyumas segera dikirim byk yg mw vaksin kedua terpaksa ditunda
brimobsumutnews,tiba di bandara knia brimob polda sumut kawal vaksin sinovac
chikomaith,kenapa yang vaksin sinovac mayoritas rata rata gak ada efek setelah vaksin kenapa aku berbeda trauma deh
JKJAVMY,pada hari yang sama malaysia turut menerima sumbangan vaksin sinovac sebanyak dos daripada kerajaan china
DrSLSimonSpKK,kalau terbang ke jerman selain syarat punya visa schengen jerman jerman hanya mengakui vaksin yg disetujui ema eu
nitia_a,iya ya tapi untung sekarang pilihannya uda lebih banyak dibanding dulu ga cuma sinovac maksudnya
Polsekjetisbtl,kanit samapta polsek jetis iptu poniman pimpin giat pengamanan vaksinasi dari rs bhayangkara polda diy di pendopo k
Sinovac_pick,semoga hari ini bisa menang di kak chota pgn beliin frezer buat emak
ccn9613,kemarin banyak banget kabar bahagia vaksin sinovac ku diakui lulus s1 ya rabb may you always give me many miracle in my life
neirapenguin,itu karena terbukti sinovac dosis setlh bulan cuman efektif maka disuruh booster ktnya mau
parisfyy,kalo sinovac efeknyaa pegel doang yaa okeyyy makasih infoo yaa keii
sfararo,sesiapa yg vaksin sinovac perlu tunggu arahan kkm utk dapatkan dos booster waktu idah dos booster adalah dalam su
drunkedsummer,kecil kokk pikirin yang lain ajaa jangan diliat oh kalo sinovac efek sampingnya minim bangeet paling cm pegel dikit
MarhasakP,jd bagi masyaralkat yg sudah vaksin sinovac ini sudah tidk ada mslah lagi
mywonshine,sinovac lg buat boosternya jd 3nya sama
chaerandwnti,gubenur khofifah jg menyampaikan secara spesifik bhw vaksin sinovac jg sudah disetujui organisasi kesehatan dunia
sfararo,soalan aku kalau sekarang kita ada vaksin sinovac then kita plan untuk ambil vaksin pfizer adakah rekod vaksin s
Sekbringin86,giat gerai vaksin merdeka tahap 1 di smpn bringin giat vaksinasi covid dosis dengan menggunaka vaksin sino
KodimKarangany1,karanganyar jum at tanggal oktober serda yuli purwanto babinsa desa klodran koramil colomadu bersama p
PR_EventMarcomm,kali ini sentra vaksinasi masjid salman itb akandibuka padaenin kamis pkl 12 00 wibjumat pkl 11
HeyyFarahhhh,sampe akhirnya ada sahabat yg tinggal dekat dg asrama sekolah anakku dibantulah supply jamu utk anakku beliau jg
HeyyFarahhhh,bersyukur banyak sm allah hidupku dikelilingi orang baik anakku ini kemarin senin vacs pfizer aku kasih iji
Danialskops,kebetulan aku amik sinovac
mashilfi,vaksinnya anda sinovac
FirmRei,panglima tni dan kapolri hadiri serbuan vaksinasi sinovac masyarakat maritim banyuwangi dansekitarnya
BendaPolsek,anggota polsek benda melaksanakan pengamanan kegiatan vaksinasi di polsubsektor duta garden jl husein sastra negar
MbahUdheg,seperti studi vaksin sinovac yang dilakukan di bandung soal yang vaksinasi tenaga kesehatan itu menurun setelah
Aris_Munandar90,dulu pada mencibir sinovac buatan china sekrang terbukti sinovac ampuh dan digunakan di negara
papa4bby,capek2 pagi2 ngantri di puskesmas cacing eh cuma ada sinovac padahal daftar di aplikasi jaki diketerangannya ada p
erenanggrai,dmne yak hari ini vaksin kdua sinovac di ktg ni ye ad ny yg astrazeneca jak hm
DepokKoramil,sleman komando distrik militer sleman bekerjasama dengan dinkes kabupaten sleman uty aparat terkait dan s
agustxdk,alhamdulillahsinovac kak
kimwhalien52,ini sinovac katanya tapi gak tau juga
iciocaica,apalah aku warga sinovac
PRBekasiRaya,jadwal dan info vaksin gratis bekasi oktober sinovac astrazeneca dan pfizer
sherrychiu__,link pendaftaran vaksinasi dosis dan sinovac di sidoarjo oktober berhadiah souvenir
hanny_nr,selain itu who yang merekomendasikan pemberian booster pada lansia strategic advisory group of experts on immuniza
ffffffffarah,beda2 tetep aku vaksin kedua sinovac meriang ortu mahh jagjag
vacnilad,bukann sinovac yg sesi kemaren katanya sih dah abis tp gatau jg
haneyeah,bismillah aamiin terus baru inget vaksin ya sinovac bhaaay mrie bergandeng tangan dan menghalu bersamaq
MJabodetabekCom,cek jadwal dan tempat vaksin sinovac astrazeneca dan moderna di surabaya tanggal sampai oktober
m_jabodetabek,cek jadwal dan tempat vaksin sinovac astrazeneca dan moderna di surabaya tanggal sampai oktober
deskeyyy,aku nanya2 random ke adekku jadi kamu vaksin apaan krn gw taunya dia ga dikasi tau vaksin apan adek senyum2 k
traxxfmofficial,kementerian kesihatan telah menghubungi kerajaan united kingdom dan arab saudi untuk mempertimbang semula keputusan
yusuprhmn,eh harusnya hari ini kan tp digeser besok vaksin ke dua jadinya gimana sinovac aman ga dosis keduanya biar minggu bisa santai
tegalfess,tf info vaksin sinovac dosis dua bwt hari ini besok
iicyaaa,assalamualaikum yb boleh tak sekiranya dapat dipercepatkan vaksin booster bagi yg ingin buat umrah esp
Sinovac_pick,jumat berkah
Muhamma39480600,vaksin sinovac sudah tidak ada masalah tapi kementerian kesehatan arab saudi masih akan berkoordinasi dengan keme
MJabodetabekCom,update info jadwal vaksin sinovac dan astrazeneca dosis amp di jatisampurna bekasi
m_jabodetabek,update info jadwal vaksin sinovac dan astrazeneca dosis amp di jatisampurna bekasi
Sinovac_pick,semangat
ArandraFitri,beliau tadi juga menyampaikan secara spesifik bahwa vaksin sinovac juga sudah disetujui organisasi kesehatan dunia
TimpalBali,kle info vaksin kedua sinovac dong di dps
TheKopRossonero,namanya ikut vaksinasi ya disuntik vaksin entah itu sinovac astra zeneca atau pfizer abis vaksin
depokita,informasi vaksinasi covid 19 di universitas bsi kampus margonda periode 20 oktober menggunakan vaksin sinov
convomfs,wta aku ada benjolan sekitar pd belum sempet konsul ke dokter tapi hari ini aku mau ikut vaksin sinovac do
kookoophi,kl sinovac knp ka
PareFess,info tolong info vaksin sinovac dosis di polres pare udah full e kuota e makasih cah pare
KediriFess,info tolong info vaksin sinovac dosis di polres pare udah full e kuota e makasih cah
jijucityx_dee40,nakes btw dos k krn sblumnya sinovac atw mmg semua vaksin hrs ada ke untk nakes
itsmeyaa_,colleague aku kalau bercerita ada kenalan dia kena covid mesti nak kena mention si polan si polan vaccine pfizer si
WEverpeople,merdeka kuota dosis dan sinovac untuk pelajar di surabaya
bebasbaru,bersiap yang ingin umrah ingat vaksin jangan sinovac cina tapi produk eropa arab alergi dengan cinayang pin
MrsRanTakahashi,bersyukur banget gue waktu itu vaksin dosis amp pake sinovac efek sampingnya cuma tangan pegel amp laper terus ke
sherrychiu__,info vaksinasi covid 19 dosis dan sinovac di malang oktober gratis kopi dan ada doorprize
tendobakso,bagusan vaksin sinovac atau asgard
po11819597,masih inget si didu soal vaksin sinovac ahirnya dia vaksin juga pake alhamdulilah lagi hahaha didu didu
sherrychiu__,link pendaftaran vaksinasi covid 19 astrazeneca dan sinovac di ciputra mall surabaya oktober
yhendarsyah,gw kepengen pake vaksin astrazeneca untuk vaksin kedua ternyata gak bisa karena vaksin pertama gw sinovac dan ini
asumsico,dalam aturan kemenkes ibu hamil hanya dapat diberikan jenis vaksin merk pfizer moderna dan sinovac
om_didik,pelaksanaan vaksinasi sinovac dosis di balai desa sumberwudi kecamatan karanggeneng berjalan dengan lancar
kusumatiar,saya sudah menunggu di pkm pwt utara dari pagi mereka buka sampai hampir jam tanpa mendapatkan
DepokKoramil,sleman komando distrik militer sleman bekerjasama dengan aparat terkait dan stakeholder kembali melaksanak
smaks_72,selamat pagi buat admin tanya dong untuk vaksinasi sinovac daerah cipayung dimana yg ada minggu ini
BaseAnakFK,dok kalo dosis ke 2 vaksin sinovac boleh kurang dari hari engga ya atau harus banget hari mohon dibantu jawab ya
piracila,vaksin sinovac halal dan suci
piracila,vaksin sinovac halal
Sinovac_pick,kapan dor saya om
asyiqmln,yang udah x vaksin sinovac ngrasain kalo sendi siku kanan pegel ngga kaya ngga nyaman gitu
Byaku_RENN,ini sama sinovac bakal susah kalo kalian masuk ke europe kususnya prancis
venuszxyy,nyari vaksin sinovac dosis daerah sda mana si susah bgt
jiminsdee,sinovac ga kenapa2 sih kalo adekku pas dosis wkwkwkwk semoga aman2 aja ya amin
mywinterrbear,mudah2an ga yg sampe demam2 wkwk pas vaksin pertama sih aku cuma ngantuk doang efeknya sm t
kaniasaja79,iya e sinovac ga laku di luar
eventsurabaya,halo gais yukkk dengan mendukung program pemerintah pkb mengadakan vaksinasi sinovac dosis dan dengan kuota
ooopsiieee,astra disini yang dosis malah udah jarang adanya cuman sinovac
kaniasaja79,iya e sinovac gabisa hvft
kaniasaja79,uk dah open tapi sinovac gabisa bm vaksin lagi moderna pfizer gini ini aku
doublebe99,ii sumpah kzl bgt td gua kan ke kelurahan buat nanyain sertif vaksin gua knp blm keluar udh mingguan trs nanya l
ekstronaut,sinovac jg udah tahap dong
TComehere,hallo ibu mentri sehat selalu ya bu beberapa negara hanya mengijinkan masuk para traveller yang di va
juicybuby,kalau kebutuhan utk keluar negeri sebaiknya emg bukan sinovac sih ya
__samsepiol,jd ada negara yg ga terima vaksin sinovac buat msk ke negara tsb jd skrg aku lg pusing nih hahahaha krn va
__samsepiol,jd ada negara yg ga terima vaksin sinovac buat msk ke negara tsb jd skrg aku lg pusing nih hahahaha
__samsepiol,iya sich bener emg gitu tp lbh ke alesan teknis sih jd ada negara yg ga terima vaksin sinovac jd skrg
kecpiyungan1,info vaksinasi lagi lur monggo sederek teman keluarga yang belum vaksin di buka pendaftaran vaksinasi sin
airlanggafess,uner info vaksin sinovac rek
WEverpeople,merdeka kuota dosis dan sinovac untuk pelajar oleh tni polri pemkot sb
__samsepiol,shittt nyesel vaksin sinovac
tressdiana,eh serius lu sinovac atau apaaa
reverieain,sinovac ni memang side effect dia lenguh sejam dua je eh best jugak
Riskidwiaaa,setauku sing serbuan baru2 ini baik kota kabupaten infonya masih sinovac nang
iqbalhafizon,adapun temuan yang dimaksud sage who masih menyasar kepada kelompok umur lansia hal ini dikarenakan temuan efektiv
MrsRanTakahashi,di puskesmas daerah sini udah gak ada sinovac buat dosis makanya jadinya pake moderna soalnya ting
iqbalhafizon,proritas vaksinasi kepada kelompok lansia menjadi semakin urgent kala sage who merekomendasikan kelompok lansia yan
MoelyonovDjalil,sinovac kedua alhamdulillah selamat malam sehat selalu
GadoyanKopi,loh knp ga pake sinovac kalo mau cari sinovac d klinik2 aja aku kmrn vaksin dosis pake sinovac
Unsoedfess1963,jends info vaksin sinovac dosis pertama dong di pwt
MrsRanTakahashi,iya sih baca review dari orang pada kayak gitu untung sinovac gak ngasih efek gimana cuma bikin ta
etdahheran,jenis vaksin namanya sinovac ada juga yang astarzaneca aduh fak aku gak ganyangca
larascitraayu,nakes indo cannot yah secara kita semua x sinovac x moderna ttp keitungnya not fully vaccinated so saddd good
Muflichaptri,bukan sinovac
binyeolie,yg kedua rasanya kek lebih nyelekit gitu tp sembuhnya cepet w dapet sinovac
PenLanalBwi,tni al dahsyat serbuan vaksinasi sinovac masyarakat maritim banyuwangi dan sekitarnya hadirkan panglima tni dan
m_jabodetabek,info jadwal vaksin pfizer dan sinovac jatisampurna kota bekasi oktober
MJabodetabekCom,info jadwal vaksin pfizer dan sinovac jatisampurna kota bekasi oktober
callmemiwww,depend deh keknya tergantung vaksin juga kemaren ku pake sinovac efek sampingnya cuma ngantuk aja sih
miyachimeng,kamu vaksin apa klo aku sinovac emang katanya gak terlalu bakalan nimbulin efek sihh paling pegel doang
hidayahabdmalik,nope ak sinovac jugak
nadzym,hang tak dapat meh untuk sinovac user kot
CommuterLine,selamat malam untuk vaksinasi stasiun duri yang akan berlangsung di tanggal amp oktober yait
akmalmilan01,sampe sekarang sinovac masih ditolak singapur bang
dindafadilla,info vaksin dos sinovac daerah bsd serpong sekitar nya lupa bgt jadwal vaksin saking lamanya nunggu bisa vaksin dos
nadzym,confident lebih dan improve aiming valo hahahaha untuk sinovac hospital ws aku panggil sukarelawan cucuk booster sinovac
Sinovac_pick,perlu di cek sih dana buat bayarbitu dana dr mana
PKCTamansari,sinovac dosis dan kantor rw mangga besar 180 orang masyarakat umum gt 12 th 2 samping koramil masyar
icahicahnai,untung izin ambil day off ternyata beneran selemes ini kirain nd dose sinovac di aku gabakal kenapa napa tapi letoy banget ini badan hwhw
zeeegirl,yaa tergantung vaksinnya sii kalo ak kemaren sinovac jdi gasakit apa
qwertyntanraz,maaf mau nanya klo divaksin pertama itu aku dapetnya sinovac nah misal divaksin kedua dapetnya pfizer moderna gitu bisa gasih
heynutnuts,london aamiin hayuk sinovac bisa yuk
PDI_Perjuangan,hari ini menurutnya sekitar warga yang harus mereka vaksin untuk tahap dua karena sebelumnya pada tahap per
zona_raya,vaksin merdeka kuota dosis dan sinovac untuk pelajar oleh tni polri dan pemkot surabaya
eccedntst,yg ada cma ituuudh selesai vksin bru tau klau dsklh ada yg sinovac anjrr
rubbie2525,belum tau juga ini ak berkaca aja dr desa tetangga yg dapetnya astra kalo desaku emang belum keluar j
HazriBinHarun,tuan saya ada keliru adalah untuk pfizer vaccine kan what about others vaccine ie az and sinovac
creamattcha,engga kok amann aku dapetnya sinovac sih katanya emang lebih ringan paling pegel aja bahunya harian gitu
PolresTasikKota,gerai vaksin presisipolres tasikmalaya kotadilaksanakan pada hari tanggal jum at oktober pukul
PolresTasikKota,gerai vaksin presisipolres tasikmalaya kotadilaksanakan pada hari tanggal jum at oktober pukul
SweetyOct,dapat berita agak menggembirakan bhw turis ke jerman tdk perlu karantina mandiri lg hny bagi kami vaksin yg suda
ephilarity__,iya sih ini vaksin sinovac
Lantari7,komando distrik militer sleman bekerjasama dengan aparat terkait dan stakeholder kembali melaksanakan serbuan
yuniapusp,iya sinovac heheasli pegel bangettt ini
semburatsendja,dapat sinovac lagi biasanya vaksin kedua lebih berasa sih
WEverpeople,merdeka kuota dosis dan sinovac untuk pelajar oleh tni polri pemkot sb
RurupanMaoru,tadi nanya katanya sinovac engga diterima di perancis jadi harus vaksin ulang
Lantari7,kodim sleman dinkes kab sleman dan stakeholder kembali menggelar serbuan vaksinasi untuk pelajaran dan masyar
Lantari7,komando distrik militer sleman bekerjasama dengan aparat terkait dan stakeholder kembali melaksanakan serbuan
UbsiFatmawati,sentra vaksin covid 19 universitas bsi kampus margonda bekerjasama dengan polsek beji lokasi sentra vaksin ubsi
fluffykim_,jadi inget kejadian ibukku pas habis vaksin sinovac pas itu tangan bekas suntikannya ga sengaja ku gebuk
jingglang,nambahin data bang ini titer antibody bulan stlh vaksin sinovac kedua dulu sebelum vaksin per
humas_polsekjtu,yuk vaksin vaksin sinovac dosis dan lihat waktu dan tempat diatas
vacnilad,gatau jenisnya apa wakakak yg jelas bukan sinovac
nurulhadirah___,tadi atuk aku ngadu la tak dapat gi umrah dah sebab aku dengan dia dapat sinovac astu dia ajak gi china pulak aku pun
humasreslamteng,tni polri bersama forkopimda kab lampung tengah menyelenggarakan gerai vaksinasi sinovac dan astrazeneca gratis
winnyiethepooh,gimana caranya orang yang waktu itu vaksinnya sinovac supaya bisa travelling ke europe
DraftAnakUnpad,gais ada yg telat seminggu vaksin sinovac dosis gaa aku telat huhu
BlueAng16621833,jgn lupa rd dose bagi semua penerima vaksin sinovac
Kodim_Sragen,dukung program pemerintah serka abdus salam babinsa desa pengkok anggota koramil kedawung melaksanakan monitori
lltfcan,aku udah sinovac ga ada efek nya cuma pegel doang
iPinchDobby,blom kemarin ada astrazeneca udah mau didaftarin ttapi guenya masih terlalu unyu belum bisa kecuali yg sinovac sih
lhadianti06,aku udah tapi bukan sinovac
iPinchDobby,astrazeneca lebih bagus sih katanya dari sinovac tapi efek sampingnya juga lebih besar terus harus t
querenciamine,aku vaksin kedua sinovac gak ada efek apa apa kayak gak disuntik malah lanjut kerja lagi
Drubiyantoro,pengen banget ke negara saudi arabiah biar nanti bisa dapat vaksin ke soalnya saya sudah vaksin kali si
MahasiswaUMS,umsfess ke sinovac nanti ke apa jg sama
malangvoice,bin jatim suntik santri ponpes al rifai e dengan sinovac
Adeima_Novita,assalamualaikum bapak bapak mohon ijin di kabupaten purbalingga vaksin dosis kedua untuk vaksi
takeoverthem00n,iyaaa waktu itu masih pake sinovac sih tapi baksin kedua gaada reaksi apa apa cuma ngantuk sama pegek doanggg
depok_pos,puskesmas sukatani buka pendaftaran vaksinasi sinovac
jogmfs,jog tlg info vaksin dosis sinovac bebas dosis darimana saja karena vaksin tunda jadi stok sinovac di tempat lama habis nuwun
_taehyeonggg,sinovac tadi baru dapett
amwidyou,bulan lalu sayang aku vaksin pertamanya berarti dira usia sebulan cari aja yang ngadain vaksin sino
m_jabodetabek,jadwal vaksin covid 19 di stadion pakansari bogor oktober tersedia sinovac astrazeneca dan moderna
MJabodetabekCom,jadwal vaksin covid 19 di stadion pakansari bogor oktober tersedia sinovac astrazeneca dan moderna
ore_0o,sinovac jg aman untuk penyandang autoimun asal sudah remisi dan konsul ke dokter dulu
GrogolPolsek,wakapolsek grogol iptu siswanto s h m h pimpin monitoring pelaksanaan vaksinasi merdeka candi polres sukoharjo
imiKPark,aku sinovac ngga
Kodim_Sragen,pada hari kamis oktober pukul wib s d selesai babinsa ds dukuh koramil tangen melaksanakan pendam
Kodim_Sragen,wujud kepedulian wilayah babinsa ds ngrombo koramil tangen melaksanakan giat pendampingan vaksinasi lansia dosi
Kodim_Sragen,babinsa ds galeh koramil tangen be kec tangen mendampingi ibu siti bidan desa galeh dan kader kesehatan desa gal
Adelleww2,iya katanya soalnya ada negara yang ga mengakui sinovac
Callmesopi,asli deh kerja aja gak kuatsinovac
KoramilSleman,sleman kodim sleman dinkes kabupaten sleman dan stakeholder kembali menggelar serbuan vaksinasi untuk pel
YkaKotagede34,kamis oktober pukul wib di puskesmas kotagede jln kemasan kotagede telah berlangsung kegiatan vaks
mrsjongseong,aku sinovac b ajaaa
safnaajengS,ko sinovac dose pegel yaa
rubbie2525,klo sinovac ak berani klo astra banyakan pd yg sampai demam parah jd masih ragu ragu
Sansspeedprject,asline aku kuat koyo boboboy tenantapi bar disuntik vaksin sinovac winggi kekuatanku dadi ilang kabeh
GengRetail,mesirdengan vaksin lengkap iaitu pfizer moderna astrazeneca sinopharm sinovac sputnik v amp janssen johnson amp
anakhiIang,aku sinovac ga ngerasa efek apa apa sih
polsek_karawaci,vaksinasi merdekajumat oktober berlalu untuk umummelayani dosis dan vaksin jenis sinovac dan astr
jinternall,aku vaksin kedua sinovac gaada efek apa nder malah lebih pegel pas vaksin pertama
moarcadiaa,sinovac ya aku juga gitu kokk mana laperan
HumasPolsekKed4,tni polri pantau giat vaksinasi dosis dan jenis sinovac di halaman rumah kades waringinjaya kamis 14 10 2021
zackyrvai,iya tp efektivitasnya lebih better moderna pfizer kan tp gpp deh kebagiannya sinovac hehe
cutebearning,iya kalo moderna emang keras tapi gw pake sinovac tau
rahmakanjanaa,info vaksin pontianak nih guys untuk vaksin pake pfizer dan vaksin sinovac lesgooo daftar mumpung kuotanya ma
radar_malang,sinergi mahasiswa umm dorong percepatan herd immunity desa tegalgondo
chanahchani,jan lupa cari info vaksinnya jg siapa tau kalian pakenya sinovac gpp di suntik lg itung boster
detikhot,arab saudi membuka pintu bagi penerima vaksin sinovac untuk umroh dengan syarat wajib sudah booster menkes ri men
detikHealth,arab saudi membuka pintu bagi penerima vaksin sinovac untuk umroh dengan syarat wajib sudah booster menkes ri men
detikcom,arab saudi membuka pintu bagi penerima vaksin sinovac untuk umroh dengan syarat wajib sudah booster menkes ri men
Sapuran6,adu kekuatan adu argumentasi saudi rekomendasi vaksin selain sinovac bahasa kasarnya tdk mengakui sinovac
inceklebih,katanya sinovac sih yg lebih minim efek
detikHealth,arab saudi membuka pintu bagi penerima vaksin sinovac untuk umroh dengan syarat wajib sudah booster menkes ri men
bbuterfliess,sama aku jg sinovac amp vaksin kedua tuh pegel bangett beda banget sm vaksin pertama
zackyrvai,wah dapat az tp kamu alhamdulillah ya ga ada side effectnya aku pengennya jenis lain sebenarnya tp kebagiannya sinovac
bugismanis1,sinovac seh
natata95_,aku sinovac iya vaksin kedua parah bgt pegelnya yg pertama gak kerasa
zackyrvai,hai teman2 disini ada yg cd4nya di bawah tp udah vaksin share pengalamannya dong besok aku ada jadwal vaksin tp dapet sinovac
hapviily_,lu vaksin apa sa az atau sinovac
Destiwib,nah itu dia aku juga bingung udah kepalang dapet sinovac tapi ga bisa ke jepang udah dapet solusi belum
jiminsdee,loh sinovac lolos tah us
PInSemar,buat sedulur yang belum divaksin yuk bisa yuk manfaatkan layanan vaksinasi sore hari
beritamanado,berita terbaru alumni akabri gelar vaksinasi sinovac dan astrazeneca di tomohon
unknowuser4844,yb menteri kesihatan tolong beritahu saya bahawa di manakah tempat untuk penyuntikan sinovac bagi pel
theunfixable1,ini vaksin pertama sinovac kok tangan gw pegel bgt dah _
firmansanyoto,jadual vaksinasi covid kecamatan genteng yang dilakukan oleh polresta b
Polres_balangan,polres balangan beserta dinkes kabupaten balangan kembali mengelar vaksinasi presisi di aula polres balangan pada
plskwasbandara,pengawalan dan pengamanan kedatangan vaksin sinovac dan vaksin pfrizer yang akan di kirim memuju gudang dinkes prop
SweetyOct,alhamdulillah bagus pak moh fardi dpt vaksinnya bisa dpt visa schengen tdk seperti s
plskwasbandara,kedatangan vaksin sinovac dan vaksin pfrizer dari jakarta melalui bandara int l supadio di peruntukan dinkes propin
jurtastel,vaksin booster ke sinovac semoga ga kenapa napa
cherry9621,seriusan yang pertama sinovac yang kedua pfizer
cherry9621,klo vaksin pertama sinovac terus vaksin kedua pfizer itu boleh ngga sih
RKlVEWORLD,sinovac kalau gak salah
iwanurdin,mau tanya min yang bisa vaksin dosis kedua langsung sinovac dimana ya
TakBerdoi,wkwkwk vaksinnya apa gitu lho sinovac kah atau apa
grumpycaca,moderna aja tp ak sinovac si
ariyatasenpai,mak aku terpaksa tangguh umrah hujung tahun ni sebab yg cucuk sinovac kena ada rd dose baru dpt pergi i just lost a words
Hamzah342,asaalam dr saja nak comfirm boleh ke vaksin sinovac dos dos ke3 fuzer terima kasih
SinarTerkini,pendistribusian vaksin sinovac dikawal danramil dan babinsa koramil wonosari
Ohherara,sinovac tp bru dosis
artineutami,ibuk bapakku abis vaksin biasa aja g ngrasa apa2 kirain dpt sinovac ternyata moderna
GesuriID,bupati landak karolin margret natasa memantau secara langsung berjalanya proses pelaksanaan gebyar vaksinasi sinova
depokinfo_,puskesmas sukatani buka pendaftaran vaksinasi sinovac dosis satu dan dua depok news
PR_EventMarcomm,kali ini sentra vaksinasi masjid salman itb akandibuka padaenin kamis pkl 12 00 wibjumat pkl 11
kursipijat,berapa lama vaksin sinovac bisa bertahan
Sinovac_pick,saya stay disini kak liatin kak chita siapa tahu mau ngedor saya buat beliin emak
RajasaFx,ri keluar dari red list inggris ini syarat perjalanannya vaksin sinovac tidak diakui
HMTSUII,bagi peserta vaksin dosis sudah menerima vaksin dosis sinovac dengan jarak minimal hari5 tidak terdaft
sygmollymochi,harus di booster yang pake sinovac
Humas_ResPBG,polres purbalingga kembali menyelenggarakan vaksinasi dosis dua jenis sinovac untuk karyawan perusahaan
inginkansurga,selamat siang dok izin tanya beda vaksin moderna sama sinovac apa ya dok katanya bagusan moderna ya dok terimakasih dok
ziqqhaziq_,tak kisah kau astrazaneca ke sinovac ke pfizer ke asalkan benda tu vaksin jugak
